{
  "schemaVersion": "1.0.0",
  "command": "sql import",
  "status": "succeeded",
  "startedAt": "2026-08-19T00:00:00Z",
  "completedAt": "2026-08-19T00:05:00Z",
  "target": {
    "kind": "database",
    "resourceId": "/subscriptions/00000000-0000-0000-0000-000000000000/resourceGroups/rg-mh-example/providers/Microsoft.Sql/servers/sql-example/databases/catalog",
    "family": "azure-sql",
    "authentication": "managed-identity",
    "localAdministratorPrincipal": null,
    "entraAdministratorPrincipal": null,
    "applicationPrincipal": {
      "name": "id-mh-example",
      "kind": "managed-identity",
      "principalId": "00000000-0000-0000-0000-000000000002"
    }
  },
  "artifact": {
    "format": "bacpac",
    "exportTool": {
      "name": "SqlPackage",
      "version": "170.4.83"
    },
    "importTool": {
      "name": "SqlPackage",
      "version": "170.4.83"
    },
    "sha256": "0000000000000000000000000000000000000000000000000000000000000000",
    "bytes": 1
  },
  "imageVerification": null
}
